{
  "authority": {
    "authority_level": "evaluation_request_only",
    "can_certify_done": false,
    "final_status_authority": "certifier_only"
  },
  "capture_policy": {
    "does_not_call_live_models": true,
    "does_not_include_model_outputs": true,
    "modes": [
      "normal_prompt",
      "multiframe_harness"
    ],
    "required_task_count": 100,
    "requires_external_capture": true
  },
  "claim_boundary": "This request pack is a capture to-do list only. It is not model output, live evidence, scoring evidence, or final certification.",
  "prompt_set_id": "stage1_multiframe_settlement_50",
  "request_pack_id": "stage1_live_capture_request_pack_50x2_v2",
  "schema_version": "stage1_capture_request_pack_v1",
  "tasks": [
    {
      "capture_instruction": "Treat the text between <benchmark_prompt> tags as the user question. Answer that question directly in normal prompting mode. Do not restate these instructions. Do not use an explicit multi-frame scaffold unless you would naturally do so.\n\n<benchmark_prompt>\nShould I build an agent harness?\n</benchmark_prompt>",
      "expected_capture_fields": [
        "prompt_id",
        "mode",
        "provider",
        "model",
        "model_version",
        "prompt_text",
        "prompt_hash",
        "system_prompt_hash",
        "output_text",
        "output_hash",
        "captured_at",
        "capture_method",
        "provenance"
      ],
      "forbidden_actions": [
        "Do not fabricate model output.",
        "Do not omit failed attempts from provenance.",
        "Do not claim final authority or task completion status.",
        "Do not include secrets or API keys.",
        "Do not write protected status artifacts."
      ],
      "mode": "normal_prompt",
      "prompt_hash": "911a3fe5e403c57fd9619179296a9e1281b34d2e3a3037308f432b001deb4d55",
      "prompt_id": "agent_harness_001",
      "prompt_text": "Should I build an agent harness?",
      "task_id": "agent_harness_001::normal_prompt"
    },
    {
      "capture_instruction": "Treat the text between <benchmark_prompt> tags as the user question. Answer that question using the grounded multi-frame harness. Do not restate these instructions.\n\nRequired structure:\n1. Known facts from the prompt only.\n2. Assumptions, each labeled prompt-supported or speculative.\n3. Unknowns / unavailable evidence.\n4. Claims needing evidence before they can be trusted.\n5. Distinct frames with attacks on weak paths.\n6. Rejected bad frames, especially frames that rely on unstated facts.\n7. Final direction that separates supported conclusions from unknowns.\n\nDo not invent repo state, tool access, citations, benchmark results, product claims, hidden context, CI status, dependencies, or live checks. Do not claim completion authority.\n\n<benchmark_prompt>\nShould I build an agent harness?\n</benchmark_prompt>",
      "expected_capture_fields": [
        "prompt_id",
        "mode",
        "provider",
        "model",
        "model_version",
        "prompt_text",
        "prompt_hash",
        "system_prompt_hash",
        "output_text",
        "output_hash",
        "captured_at",
        "capture_method",
        "provenance"
      ],
      "forbidden_actions": [
        "Do not fabricate model output.",
        "Do not omit failed attempts from provenance.",
        "Do not claim final authority or task completion status.",
        "Do not include secrets or API keys.",
        "Do not write protected status artifacts."
      ],
      "mode": "multiframe_harness",
      "prompt_hash": "911a3fe5e403c57fd9619179296a9e1281b34d2e3a3037308f432b001deb4d55",
      "prompt_id": "agent_harness_001",
      "prompt_text": "Should I build an agent harness?",
      "task_id": "agent_harness_001::multiframe_harness"
    },
    {
      "capture_instruction": "Treat the text between <benchmark_prompt> tags as the user question. Answer that question directly in normal prompting mode. Do not restate these instructions. Do not use an explicit multi-frame scaffold unless you would naturally do so.\n\n<benchmark_prompt>\nIs this paper idea novel?\n</benchmark_prompt>",
      "expected_capture_fields": [
        "prompt_id",
        "mode",
        "provider",
        "model",
        "model_version",
        "prompt_text",
        "prompt_hash",
        "system_prompt_hash",
        "output_text",
        "output_hash",
        "captured_at",
        "capture_method",
        "provenance"
      ],
      "forbidden_actions": [
        "Do not fabricate model output.",
        "Do not omit failed attempts from provenance.",
        "Do not claim final authority or task completion status.",
        "Do not include secrets or API keys.",
        "Do not write protected status artifacts."
      ],
      "mode": "normal_prompt",
      "prompt_hash": "353d03f9281da31c1238c33750ff2c7a961e68012f6367f01bb376c28776daec",
      "prompt_id": "paper_novelty_001",
      "prompt_text": "Is this paper idea novel?",
      "task_id": "paper_novelty_001::normal_prompt"
    },
    {
      "capture_instruction": "Treat the text between <benchmark_prompt> tags as the user question. Answer that question using the grounded multi-frame harness. Do not restate these instructions.\n\nRequired structure:\n1. Known facts from the prompt only.\n2. Assumptions, each labeled prompt-supported or speculative.\n3. Unknowns / unavailable evidence.\n4. Claims needing evidence before they can be trusted.\n5. Distinct frames with attacks on weak paths.\n6. Rejected bad frames, especially frames that rely on unstated facts.\n7. Final direction that separates supported conclusions from unknowns.\n\nDo not invent repo state, tool access, citations, benchmark results, product claims, hidden context, CI status, dependencies, or live checks. Do not claim completion authority.\n\n<benchmark_prompt>\nIs this paper idea novel?\n</benchmark_prompt>",
      "expected_capture_fields": [
        "prompt_id",
        "mode",
        "provider",
        "model",
        "model_version",
        "prompt_text",
        "prompt_hash",
        "system_prompt_hash",
        "output_text",
        "output_hash",
        "captured_at",
        "capture_method",
        "provenance"
      ],
      "forbidden_actions": [
        "Do not fabricate model output.",
        "Do not omit failed attempts from provenance.",
        "Do not claim final authority or task completion status.",
        "Do not include secrets or API keys.",
        "Do not write protected status artifacts."
      ],
      "mode": "multiframe_harness",
      "prompt_hash": "353d03f9281da31c1238c33750ff2c7a961e68012f6367f01bb376c28776daec",
      "prompt_id": "paper_novelty_001",
      "prompt_text": "Is this paper idea novel?",
      "task_id": "paper_novelty_001::multiframe_harness"
    },
    {
      "capture_instruction": "Treat the text between <benchmark_prompt> tags as the user question. Answer that question directly in normal prompting mode. Do not restate these instructions. Do not use an explicit multi-frame scaffold unless you would naturally do so.\n\n<benchmark_prompt>\nShould I use Mercury V2 for coding?\n</benchmark_prompt>",
      "expected_capture_fields": [
        "prompt_id",
        "mode",
        "provider",
        "model",
        "model_version",
        "prompt_text",
        "prompt_hash",
        "system_prompt_hash",
        "output_text",
        "output_hash",
        "captured_at",
        "capture_method",
        "provenance"
      ],
      "forbidden_actions": [
        "Do not fabricate model output.",
        "Do not omit failed attempts from provenance.",
        "Do not claim final authority or task completion status.",
        "Do not include secrets or API keys.",
        "Do not write protected status artifacts."
      ],
      "mode": "normal_prompt",
      "prompt_hash": "98c2e359939bf4a29415c1bec728fa7cfc90a8bc3b7d95f7010d71b73a75e75c",
      "prompt_id": "mercury_coding_001",
      "prompt_text": "Should I use Mercury V2 for coding?",
      "task_id": "mercury_coding_001::normal_prompt"
    },
    {
      "capture_instruction": "Treat the text between <benchmark_prompt> tags as the user question. Answer that question using the grounded multi-frame harness. Do not restate these instructions.\n\nRequired structure:\n1. Known facts from the prompt only.\n2. Assumptions, each labeled prompt-supported or speculative.\n3. Unknowns / unavailable evidence.\n4. Claims needing evidence before they can be trusted.\n5. Distinct frames with attacks on weak paths.\n6. Rejected bad frames, especially frames that rely on unstated facts.\n7. Final direction that separates supported conclusions from unknowns.\n\nDo not invent repo state, tool access, citations, benchmark results, product claims, hidden context, CI status, dependencies, or live checks. Do not claim completion authority.\n\n<benchmark_prompt>\nShould I use Mercury V2 for coding?\n</benchmark_prompt>",
      "expected_capture_fields": [
        "prompt_id",
        "mode",
        "provider",
        "model",
        "model_version",
        "prompt_text",
        "prompt_hash",
        "system_prompt_hash",
        "output_text",
        "output_hash",
        "captured_at",
        "capture_method",
        "provenance"
      ],
      "forbidden_actions": [
        "Do not fabricate model output.",
        "Do not omit failed attempts from provenance.",
        "Do not claim final authority or task completion status.",
        "Do not include secrets or API keys.",
        "Do not write protected status artifacts."
      ],
      "mode": "multiframe_harness",
      "prompt_hash": "98c2e359939bf4a29415c1bec728fa7cfc90a8bc3b7d95f7010d71b73a75e75c",
      "prompt_id": "mercury_coding_001",
      "prompt_text": "Should I use Mercury V2 for coding?",
      "task_id": "mercury_coding_001::multiframe_harness"
    },
    {